s_no,title,playlist_id,published_date,views,likes,month
1570,Do We Require Master OR PHD to Become Data Scientist?,UUNU_lfiiWBdtULKOw6X0Dig,2019-08-27T04:07:16Z,14208,577,Aug
1571,Answering Your Questions and Some More Updates,UUNU_lfiiWBdtULKOw6X0Dig,2019-08-26T14:35:08Z,8514,339,Aug
1572,Tutorial 2- Deployment of ML models in Heroku using FLASK,UUNU_lfiiWBdtULKOw6X0Dig,2019-08-25T13:32:56Z,169688,3820,Aug
1573,Tutorial 1- Deployment of Models- Premises VS IAAS vs PAAS cloud Platforms,UUNU_lfiiWBdtULKOw6X0Dig,2019-08-25T05:25:10Z,133513,1940,Aug
1574,How To Apply Data Science In Your Domain?,UUNU_lfiiWBdtULKOw6X0Dig,2019-08-24T13:49:24Z,5474,214,Aug
1575,Tutorial 43-Random Forest Classifier and Regressor,UUNU_lfiiWBdtULKOw6X0Dig,2019-08-24T06:03:56Z,362167,12740,Aug
1576,Important Tools and Libraries Used By Data Scientist,UUNU_lfiiWBdtULKOw6X0Dig,2019-08-23T12:37:44Z,29846,943,Aug
1577,Tutorial 42 - Ensemble: What is Bagging (Bootstrap Aggregation)?,UUNU_lfiiWBdtULKOw6X0Dig,2019-08-23T04:57:52Z,293046,7682,Aug
1578,How To Learn Data Science Smartly?,UUNU_lfiiWBdtULKOw6X0Dig,2019-08-22T15:15:04Z,1624272,51877,Aug
1579,Tutorial 22- Padding in Convolutional Neural Network,UUNU_lfiiWBdtULKOw6X0Dig,2019-08-21T14:52:19Z,126353,2902,Aug
1580,The Role of Maths in Data Science and How to Learn?,UUNU_lfiiWBdtULKOw6X0Dig,2019-08-21T13:24:48Z,103728,4029,Aug
1581,Tutorial 21- What is Convolution operation in CNN?,UUNU_lfiiWBdtULKOw6X0Dig,2019-08-20T15:49:46Z,224326,4374,Aug
1582,Tutorial 20- Convolution Neural Network vs Human Brain,UUNU_lfiiWBdtULKOw6X0Dig,2019-08-20T14:31:04Z,70372,1503,Aug
1583,How To Handle Missing Values in Categorical Features,UUNU_lfiiWBdtULKOw6X0Dig,2019-08-20T05:26:05Z,102639,2524,Aug
1584,Cosine Similarity and Cosine Distance,UUNU_lfiiWBdtULKOw6X0Dig,2019-08-19T15:08:55Z,101245,2949,Aug
1585,Euclidean Distance and Manhattan Distance,UUNU_lfiiWBdtULKOw6X0Dig,2019-08-19T14:05:24Z,239676,8083,Aug
1586,Why Do I Teach? Motivations,UUNU_lfiiWBdtULKOw6X0Dig,2019-08-17T15:10:57Z,5073,302,Aug
1587,Data Engineer vs Data Analyst vs Data Scientist,UUNU_lfiiWBdtULKOw6X0Dig,2019-08-17T12:29:37Z,175530,5573,Aug
1588,What Do A Data Scientist Do?,UUNU_lfiiWBdtULKOw6X0Dig,2019-08-16T13:58:44Z,30505,1086,Aug
1589,Why Do We Need to Perform Feature Scaling?,UUNU_lfiiWBdtULKOw6X0Dig,2019-08-15T16:32:43Z,123373,3344,Aug
1590,Different Types of Feature Engineering Encoding Techniques,UUNU_lfiiWBdtULKOw6X0Dig,2019-08-15T08:21:28Z,176142,4623,Aug
1591,How to Crack Data Science Interviews- Motivations,UUNU_lfiiWBdtULKOw6X0Dig,2019-08-14T14:59:34Z,74844,2318,Aug
1592,What should be your Salary Expectation as a Data Scientist?,UUNU_lfiiWBdtULKOw6X0Dig,2019-08-13T13:51:17Z,99650,1699,Aug
1593,Step By Step Transition Towards Data Science,UUNU_lfiiWBdtULKOw6X0Dig,2019-08-12T14:35:40Z,139657,4713,Aug
1594,Tutorial 37: Entropy In Decision Tree Intuition,UUNU_lfiiWBdtULKOw6X0Dig,2019-08-11T14:21:56Z,257240,3959,Aug
1595,Feature Engineering-How to Perform One Hot Encoding for Multi Categorical Variables,UUNU_lfiiWBdtULKOw6X0Dig,2019-08-10T15:22:08Z,236763,3084,Aug
1596,Complete Life Cycle of a Data Science Project,UUNU_lfiiWBdtULKOw6X0Dig,2019-08-10T13:31:59Z,52052,1546,Aug
1597,My Path on Becoming a Data Scientist- Motivation,UUNU_lfiiWBdtULKOw6X0Dig,2019-08-09T14:57:37Z,156008,4350,Aug
1598,Train Test Split vs K Fold vs Stratified K fold Cross Validation,UUNU_lfiiWBdtULKOw6X0Dig,2019-08-08T14:00:51Z,61333,1115,Aug
1599,What is Cross Validation and its types?,UUNU_lfiiWBdtULKOw6X0Dig,2019-08-08T12:09:20Z,213239,5224,Aug
1600,Tutorial 19- Training Artificial Neural Network using Google Colab GPU,UUNU_lfiiWBdtULKOw6X0Dig,2019-08-07T13:20:18Z,71025,1247,Aug
1601,Tutorial 18- Hyper parameter Tuning To Decide Number of Hidden Layers in Neural Network,UUNU_lfiiWBdtULKOw6X0Dig,2019-08-06T13:03:59Z,74325,1275,Aug
1602,Tutorial 17- Create Artificial Neural Network using Weight Initialization Tricks,UUNU_lfiiWBdtULKOw6X0Dig,2019-08-05T14:01:06Z,105146,1972,Aug
1603,Tutorial 5- Content Based Recommendation System,UUNU_lfiiWBdtULKOw6X0Dig,2019-08-04T16:21:05Z,66306,916,Aug
1604,Tutorial 4- Book Recommendation using Collaborative Filtering,UUNU_lfiiWBdtULKOw6X0Dig,2019-08-03T09:34:25Z,39666,547,Aug
1605,Tutorial 16- AdaDelta and RMSprop optimizer,UUNU_lfiiWBdtULKOw6X0Dig,2019-08-02T16:42:38Z,64503,1471,Aug
1606,Tutorial 3- Book Recommendation System using Pearson Correlation,UUNU_lfiiWBdtULKOw6X0Dig,2019-08-02T12:42:50Z,29689,502,Aug
1607,Tutorial 2-  Creating Recommendation Systems using Nearest Neighbors,UUNU_lfiiWBdtULKOw6X0Dig,2019-08-01T16:58:30Z,67551,1045,Aug
1608,Tutorial 1- Weighted hybrid technique for Recommender system,UUNU_lfiiWBdtULKOw6X0Dig,2019-07-31T16:48:33Z,113918,1372,Jul
1609,Tutorial 15- Adagrad Optimizers in Neural Network,UUNU_lfiiWBdtULKOw6X0Dig,2019-07-31T16:02:13Z,85311,2202,Jul
1610,Tutorial 14- Stochastic Gradient Descent with Momentum,UUNU_lfiiWBdtULKOw6X0Dig,2019-07-30T14:02:24Z,102374,2381,Jul
1611,Tutorial 13- Global Minima and Local Minima in Depth Understanding,UUNU_lfiiWBdtULKOw6X0Dig,2019-07-29T14:06:01Z,87663,1904,Jul
1612,Tutorial 12- Stochastic Gradient Descent vs Gradient Descent,UUNU_lfiiWBdtULKOw6X0Dig,2019-07-28T15:36:27Z,186530,3940,Jul
1613,Python Application to Track Amazon Product Prices,UUNU_lfiiWBdtULKOw6X0Dig,2019-07-27T15:45:56Z,7156,154,Jul
1614,Recommendation Systems using Machine Learning,UUNU_lfiiWBdtULKOw6X0Dig,2019-07-26T15:13:32Z,115449,1971,Jul
1615,Tutorial 11- Various Weight Initialization Techniques in Neural Network,UUNU_lfiiWBdtULKOw6X0Dig,2019-07-26T14:25:23Z,112010,2432,Jul
1616,Tutorial 10- Activation Functions Rectified Linear Unit(relu) and Leaky Relu Part 2,UUNU_lfiiWBdtULKOw6X0Dig,2019-07-25T15:56:16Z,131740,1984,Jul
1617,Tutorial 9- Drop Out Layers in Multi Neural Network,UUNU_lfiiWBdtULKOw6X0Dig,2019-07-24T14:09:04Z,147938,3644,Jul
1618,Tutorial 8- Exploding Gradient Problem in Neural Network,UUNU_lfiiWBdtULKOw6X0Dig,2019-07-23T13:51:02Z,116682,2883,Jul
1619,Tutorial 7- Vanishing Gradient Problem,UUNU_lfiiWBdtULKOw6X0Dig,2019-07-22T13:41:40Z,177065,3893,Jul
1620,Tutorial 6-Chain Rule of Differentiation with BackPropagation,UUNU_lfiiWBdtULKOw6X0Dig,2019-07-19T14:42:10Z,160274,3705,Jul
1621,Tutorial 5- How to train MultiLayer Neural Network and Gradient Descent,UUNU_lfiiWBdtULKOw6X0Dig,2019-07-18T17:25:38Z,184547,4489,Jul
1622,Tutorial 4: How to train Neural Network with BackPropogation,UUNU_lfiiWBdtULKOw6X0Dig,2019-07-18T09:02:35Z,198193,4519,Jul
1623,Tutorial 3-Activation Functions Part-1,UUNU_lfiiWBdtULKOw6X0Dig,2019-07-17T11:26:09Z,187503,3438,Jul
1624,Tutorial 2- How does Neural Network Work,UUNU_lfiiWBdtULKOw6X0Dig,2019-07-17T11:26:04Z,179552,2690,Jul
1625,Tutorial 1- Introduction to Neural Network and Deep Learning,UUNU_lfiiWBdtULKOw6X0Dig,2019-07-17T11:25:57Z,344923,5030,Jul
1626,Malaria Disease Detection using Deep Learning,UUNU_lfiiWBdtULKOw6X0Dig,2019-07-15T14:07:22Z,21300,341,Jul
1627,How to Read Dataset in Google Colab from Google Drive,UUNU_lfiiWBdtULKOw6X0Dig,2019-07-14T14:31:56Z,235390,2984,Jul
1628,Finding an outlier in a dataset using Python,UUNU_lfiiWBdtULKOw6X0Dig,2019-07-13T13:02:42Z,164090,2939,Jul
1629,Diabetes Prediction using Machine Learning from Kaggle,UUNU_lfiiWBdtULKOw6X0Dig,2019-07-12T14:19:36Z,104620,1761,Jul
1630,How to choose number of hidden layers and nodes in Neural Network,UUNU_lfiiWBdtULKOw6X0Dig,2019-07-11T13:10:18Z,87580,1333,Jul
1631,"Why, How and When to Scale Features in Machine Learning?",UUNU_lfiiWBdtULKOw6X0Dig,2019-07-10T06:59:41Z,27563,712,Jul
1632,Credit card Risk Assessment using Machine Learning,UUNU_lfiiWBdtULKOw6X0Dig,2019-07-09T14:00:43Z,23681,411,Jul
1633,DNA Sequencing Classifier using  Machine Learning,UUNU_lfiiWBdtULKOw6X0Dig,2019-06-28T14:47:01Z,31629,652,Jun
1634,Tutorial 46-Handling imbalanced Dataset using python- Part 2,UUNU_lfiiWBdtULKOw6X0Dig,2019-06-27T17:57:24Z,66321,1489,Jun
1635,Tutorial 45-Handling imbalanced Dataset  using python- Part 1,UUNU_lfiiWBdtULKOw6X0Dig,2019-06-27T14:39:05Z,120020,1898,Jun
1636,Hyperparameter Optimization for Xgboost,UUNU_lfiiWBdtULKOw6X0Dig,2019-06-26T13:19:26Z,108574,2048,Jun
1637,Credit Card Fraud Detection using Machine Learning from Kaggle,UUNU_lfiiWBdtULKOw6X0Dig,2019-06-25T10:51:43Z,179445,2636,Jun
1638,Voting Classifier(Hard Voting and Soft Voting Classifier),UUNU_lfiiWBdtULKOw6X0Dig,2019-06-25T09:13:01Z,24859,474,Jun
1639,Random Forest(Bootstrap Aggregation) Easily Explained,UUNU_lfiiWBdtULKOw6X0Dig,2019-06-24T12:58:02Z,28038,515,Jun
1640,Stock Sentiment Analysis using News Headlines,UUNU_lfiiWBdtULKOw6X0Dig,2019-06-23T14:10:38Z,26016,486,Jun
1641,Predicting Lungs Disease using Deep Learning,UUNU_lfiiWBdtULKOw6X0Dig,2019-06-22T12:53:13Z,52928,1035,Jun
1642,Predicting Heart Disease using Machine Learning,UUNU_lfiiWBdtULKOw6X0Dig,2019-06-21T12:50:28Z,141951,2243,Jun
1643,K Nearest Neighbour Easily Explained with Implementation,UUNU_lfiiWBdtULKOw6X0Dig,2019-06-18T13:03:24Z,229434,3875,Jun
1644,How to Visualize Multiple Linear Regression in python,UUNU_lfiiWBdtULKOw6X0Dig,2019-06-18T07:40:18Z,32594,319,Jun
1645,Deployment of Deep Learning Model using Flask,UUNU_lfiiWBdtULKOw6X0Dig,2019-06-17T17:13:32Z,80012,1302,Jun
1646,Deploy Machine Learning Model using Flask,UUNU_lfiiWBdtULKOw6X0Dig,2019-06-16T09:06:04Z,264436,4359,Jun
1647,Handling Missing Data Easily Explained| Machine Learning,UUNU_lfiiWBdtULKOw6X0Dig,2019-06-15T15:29:21Z,154807,2847,Jun
1648,Cross Validation using sklearn and python | Machine Learning,UUNU_lfiiWBdtULKOw6X0Dig,2019-06-13T14:53:08Z,11175,235,Jun
1649,Tutorial 29-R square and Adjusted R square Clearly Explained| Machine Learning,UUNU_lfiiWBdtULKOw6X0Dig,2019-06-12T16:25:15Z,140742,2776,Jun
1650,Feature Selection Techniques Easily Explained | Machine Learning,UUNU_lfiiWBdtULKOw6X0Dig,2019-06-11T15:41:02Z,199342,4259,Jun
1651,Curse of Dimensionality Easily explained| Machine Learning,UUNU_lfiiWBdtULKOw6X0Dig,2019-06-10T16:45:59Z,53068,1131,Jun
1652,DBSCAN Clustering Easily Explained with Implementation,UUNU_lfiiWBdtULKOw6X0Dig,2019-06-05T14:58:21Z,129173,2538,Jun
1653,Machine Learning Algorithm- Which one to choose for your Problem?,UUNU_lfiiWBdtULKOw6X0Dig,2019-05-30T15:30:45Z,189677,6110,May
1654,Handle Categorical features using Python,UUNU_lfiiWBdtULKOw6X0Dig,2019-05-24T15:38:00Z,32335,648,May
1655,Linear Regression Mathematical Intuition,UUNU_lfiiWBdtULKOw6X0Dig,2019-05-01T16:34:21Z,21027,358,May
1656,How to switch your career to Data Science.,UUNU_lfiiWBdtULKOw6X0Dig,2019-04-12T13:17:50Z,20869,480,Apr
1657,Setting up Raspberry pi 3 B+,UUNU_lfiiWBdtULKOw6X0Dig,2019-04-05T12:47:58Z,30261,298,Apr
1658,Deep Learning in Medical Science,UUNU_lfiiWBdtULKOw6X0Dig,2019-04-04T13:49:11Z,71507,434,Apr
1659,How we can apply Machine Learning in Finance,UUNU_lfiiWBdtULKOw6X0Dig,2019-04-03T13:22:56Z,15551,294,Apr
1660,Complete Life Cycle of a Data Science Project,UUNU_lfiiWBdtULKOw6X0Dig,2019-03-27T14:26:46Z,68664,1106,Mar
1661,Draw rectangle from webcam and sketch process it on a live feed,UUNU_lfiiWBdtULKOw6X0Dig,2019-03-03T17:13:07Z,10179,133,Mar
1662,Unlock Your Application With Your Face using OpenCV,UUNU_lfiiWBdtULKOw6X0Dig,2019-02-26T14:17:29Z,17272,371,Feb
1663,Gender Classifier and Age Estimator using Resnet Convolution Neural Network,UUNU_lfiiWBdtULKOw6X0Dig,2019-02-25T14:07:55Z,38353,534,Feb
1664,Implement Transfer Learning with a generic Code Template,UUNU_lfiiWBdtULKOw6X0Dig,2019-02-21T13:52:00Z,6395,120,Feb
1665,Hierarchical Clustering intuition,UUNU_lfiiWBdtULKOw6X0Dig,2019-02-14T19:43:10Z,60838,1191,Feb
1666,Create custom Alexa Skill- Lambda function- Part2,UUNU_lfiiWBdtULKOw6X0Dig,2019-02-14T15:20:40Z,3678,31,Feb
1667,Create custom Alexa Skill- Intent Interface- Part1,UUNU_lfiiWBdtULKOw6X0Dig,2019-02-14T15:20:29Z,10170,84,Feb
1668,K Means Clustering Intuition,UUNU_lfiiWBdtULKOw6X0Dig,2019-02-13T18:25:31Z,137303,2426,Feb
1669,K Nearest Neighbor classification with Intuition and practical solution,UUNU_lfiiWBdtULKOw6X0Dig,2019-02-12T14:55:28Z,142306,2842,Feb
1670,RandomizedSearchCV- Select the best hyperparameter for any Classification Model,UUNU_lfiiWBdtULKOw6X0Dig,2019-02-09T08:18:50Z,31090,568,Feb
1671,GridSearchCV- Select the best hyperparameter for any Classification Model,UUNU_lfiiWBdtULKOw6X0Dig,2019-02-08T16:10:28Z,81468,1809,Feb
1672,Artificial Neural Network for Customer's Exit Prediction from Bank,UUNU_lfiiWBdtULKOw6X0Dig,2019-02-06T14:57:13Z,17237,284,Feb
1673,"Precision, Recall and F1-Score",UUNU_lfiiWBdtULKOw6X0Dig,2019-02-05T13:21:06Z,85886,1232,Feb
1674,"TPR,FPR,FNR,TNR, Confusion Matrix",UUNU_lfiiWBdtULKOw6X0Dig,2019-02-04T15:39:24Z,69161,1418,Feb
1675,Movie Recommender System using Python,UUNU_lfiiWBdtULKOw6X0Dig,2019-02-02T18:37:25Z,168475,3258,Feb
1676,Dimensional Reduction| Principal Component Analysis,UUNU_lfiiWBdtULKOw6X0Dig,2019-02-02T08:04:43Z,151157,2939,Feb
1677,Multiple Linear Regression using python and sklearn,UUNU_lfiiWBdtULKOw6X0Dig,2019-01-31T16:29:03Z,140505,2906,Jan
1678,OpenPose Tutorial with Tensorflow,UUNU_lfiiWBdtULKOw6X0Dig,2019-01-23T09:41:55Z,20607,149,Jan
1679,Using OpenFace for Face recognition in Keras,UUNU_lfiiWBdtULKOw6X0Dig,2019-01-22T15:08:58Z,8450,45,Jan
1680,"Reading, Writing and Displaying images with Opencv| OpenCV Tutorial",UUNU_lfiiWBdtULKOw6X0Dig,2019-01-19T13:35:07Z,19861,278,Jan
1681,OpenCV Installation | OpenCV tutorial,UUNU_lfiiWBdtULKOw6X0Dig,2019-01-19T13:35:07Z,44377,388,Jan
1682,Face and Eye Detection from Images using HAAR Cascade Classifier,UUNU_lfiiWBdtULKOw6X0Dig,2019-01-19T13:35:07Z,22786,298,Jan
1683,Car Detection using HAAR Cascade and Opencv from Videos.,UUNU_lfiiWBdtULKOw6X0Dig,2019-01-19T13:35:07Z,13389,170,Jan
1684,Pedestrian Detection using OpenCV from Videos,UUNU_lfiiWBdtULKOw6X0Dig,2019-01-19T13:35:06Z,13462,205,Jan
1685,Face and Eye Detection from Videos using HAAR Cascade Classifier,UUNU_lfiiWBdtULKOw6X0Dig,2019-01-19T13:35:06Z,26300,415,Jan
1686,Face Recognition using open CV and VGG 16 Transfer Learning,UUNU_lfiiWBdtULKOw6X0Dig,2019-01-18T15:06:00Z,30409,419,Jan
1687,Tutorial 11-Exploratory Data Analysis(EDA) of Titanic dataset,UUNU_lfiiWBdtULKOw6X0Dig,2019-01-17T17:34:36Z,284497,5562,Jan
1688,Implementing a Spam classifier in python| Natural Language Processing,UUNU_lfiiWBdtULKOw6X0Dig,2019-01-14T14:48:21Z,106441,2237,Jan
1689,Tutorial 44-Balanced vs Imbalanced Dataset and how to handle Imbalanced Dataset,UUNU_lfiiWBdtULKOw6X0Dig,2019-01-11T17:04:02Z,41118,917,Jan
1690,"Confusion matrix, Precision, Recall| Data Science Interview questions",UUNU_lfiiWBdtULKOw6X0Dig,2019-01-10T18:58:55Z,28476,625,Jan
1691,"CBSE to introduce artificial intelligence courses in classes 8, 9, 10",UUNU_lfiiWBdtULKOw6X0Dig,2019-01-06T06:37:14Z,1451,13,Jan
1692,Covariance in Statistics,UUNU_lfiiWBdtULKOw6X0Dig,2019-01-05T17:12:02Z,128856,2765,Jan
1693,Log Normal Distribution in Statistics,UUNU_lfiiWBdtULKOw6X0Dig,2019-01-05T13:27:02Z,132252,1995,Jan
1694,Natural Language Processing|TF-IDF for Machine Learning| Text Prerocessing,UUNU_lfiiWBdtULKOw6X0Dig,2019-01-04T12:12:07Z,85290,1925,Jan
1695,Gaussian distribution or Normal Distribution in statisctics,UUNU_lfiiWBdtULKOw6X0Dig,2019-01-03T16:47:35Z,110577,2189,Jan
1696,Natural Language Processing|BagofWords,UUNU_lfiiWBdtULKOw6X0Dig,2019-01-03T15:23:31Z,92453,1953,Jan
1697,Natural Language Processing|Lemmatization,UUNU_lfiiWBdtULKOw6X0Dig,2019-01-02T17:11:31Z,76525,1162,Jan
1698,Natural Language Processing|Stemming,UUNU_lfiiWBdtULKOw6X0Dig,2019-01-01T17:28:24Z,94647,1603,Jan
1699,Natural Language Processing|Tokenization,UUNU_lfiiWBdtULKOw6X0Dig,2019-01-01T17:28:05Z,179634,2797,Jan
1700,Population vs Sample in Statistics,UUNU_lfiiWBdtULKOw6X0Dig,2018-12-31T08:20:57Z,184413,2064,Dec
1701,How to select the best model using cross validation in python,UUNU_lfiiWBdtULKOw6X0Dig,2018-09-04T16:17:54Z,65578,1542,Sep
1702,Computer Vision using Microsoft Cognitive Services for Images,UUNU_lfiiWBdtULKOw6X0Dig,2018-07-25T16:55:38Z,18255,198,Jul
1703,Principle Component Analysis (PCA) using sklearn and python,UUNU_lfiiWBdtULKOw6X0Dig,2018-07-02T15:13:57Z,196754,3429,Jul
1704,PySpark Tutorial for Beginners | Apache Spark with Python -Linear Regression Algorithm,UUNU_lfiiWBdtULKOw6X0Dig,2018-06-06T18:31:12Z,39936,616,Jun
1705,Creating a Dataset and training an Artificial Neural Network with Keras,UUNU_lfiiWBdtULKOw6X0Dig,2018-02-25T07:22:20Z,25461,245,Feb
1706,Artificial Neural Network Intuition,UUNU_lfiiWBdtULKOw6X0Dig,2018-02-24T16:42:52Z,37470,238,Feb
1707,Create an Artifical Neural Network using Keras in 5 minutes,UUNU_lfiiWBdtULKOw6X0Dig,2018-02-22T17:50:53Z,9285,89,Feb
1708,Important libraries used in python Data Science- Machine Learning Tutorial with Python and R-Part 4,UUNU_lfiiWBdtULKOw6X0Dig,2017-11-26T07:48:27Z,21073,183,Nov
1709,Anaconda installation with Packages- Machine Learning Tutorial with Python and R-Part 3,UUNU_lfiiWBdtULKOw6X0Dig,2017-11-26T06:16:34Z,77126,353,Nov
1710,What is Supervised Machine Learning- Machine Learning Tutorial with Python and R-Part 2,UUNU_lfiiWBdtULKOw6X0Dig,2017-11-26T04:50:08Z,36024,406,Nov
1711,What is Machine Learning in Data Science- Machine Learning Tutorial with Python and R-Part 1,UUNU_lfiiWBdtULKOw6X0Dig,2017-11-25T12:27:20Z,145774,890,Nov
1712,Maeri unplugged by Krish and band,UUNU_lfiiWBdtULKOw6X0Dig,2014-06-01T07:20:59Z,5564,142,Jun
1713,BI Career Starter Update & Black Friday Week Hangout,UU1bhYMFuSFREIQ5bgclLDkQ,2023-11-23T03:31:26Z,334,14,Nov
1714,Let's Practice SQL!,UU1bhYMFuSFREIQ5bgclLDkQ,2023-10-25T13:00:11Z,1464,86,Oct
1715,ETL Tools For Business Intelligence. Do We Still Need Them?,UU1bhYMFuSFREIQ5bgclLDkQ,2023-10-20T14:00:08Z,984,37,Oct
1716,How I Became a BI CONSULTANT,UU1bhYMFuSFREIQ5bgclLDkQ,2023-08-07T16:45:10Z,2362,91,Aug
1717,Maximize Data Clarity Eliminate Redundant Design Elements for Powerful Charts,UU1bhYMFuSFREIQ5bgclLDkQ,2023-07-24T21:30:37Z,328,12,Jul
1718,Maximizing Data Impact With The Data To Ink Ratio,UU1bhYMFuSFREIQ5bgclLDkQ,2023-07-24T21:27:06Z,236,9,Jul
1719,Revolutionize Your Data Visualization with a Timeless Classic,UU1bhYMFuSFREIQ5bgclLDkQ,2023-07-24T21:25:36Z,389,17,Jul
1720,The Dangerous Trend of Style Over Substance in Dashboard Design,UU1bhYMFuSFREIQ5bgclLDkQ,2023-07-24T21:24:07Z,374,13,Jul
1721,Master your business activity effortlessly with smart dashboards,UU1bhYMFuSFREIQ5bgclLDkQ,2023-07-24T20:42:41Z,289,6,Jul
1722,The Google GA4 Update that Wiped Out Years of Analysts' Work,UU1bhYMFuSFREIQ5bgclLDkQ,2023-07-24T20:25:30Z,2166,25,Jul
1723,Boost Your Career Potential Online Courses vs YouTube Channels,UU1bhYMFuSFREIQ5bgclLDkQ,2023-07-24T20:12:41Z,200,3,Jul
1724,Unleash Your Data Skills Building an Impressive Portfolio for Success,UU1bhYMFuSFREIQ5bgclLDkQ,2023-07-24T20:12:05Z,200,2,Jul
1725,Boost Your Career with Data Analysis Get Published on Medium,UU1bhYMFuSFREIQ5bgclLDkQ,2023-07-24T20:11:37Z,159,8,Jul
1726,The Global Hotspots of Business Intelligence Revealed Find out Where the Buzz is,UU1bhYMFuSFREIQ5bgclLDkQ,2023-07-24T19:49:25Z,401,6,Jul
1727,How BI Analysts Use SQL,UU1bhYMFuSFREIQ5bgclLDkQ,2023-07-24T19:44:22Z,222,13,Jul
1728,Mastering SQL as an EntryLevel BI Analyst Tips Tricks and Resources,UU1bhYMFuSFREIQ5bgclLDkQ,2023-07-24T19:21:28Z,224,5,Jul
1729,An Introduction To Google Cloud Platform (GCP) For Data Analysts,UU1bhYMFuSFREIQ5bgclLDkQ,2023-07-13T13:30:08Z,1236,48,Jul
1730,The Growth of Business Intelligence,UU1bhYMFuSFREIQ5bgclLDkQ,2023-06-20T13:00:07Z,4462,97,Jun
1731,📊 Google Analytics 4 + BigQuery | How To Link BigQuery GA4 Tutorial To Build Reports,UU1bhYMFuSFREIQ5bgclLDkQ,2023-06-13T14:00:08Z,2013,68,Jun
1732,Live Data Analysis Watch-a-long + Q&A,UU1bhYMFuSFREIQ5bgclLDkQ,2023-05-11T03:11:26Z,786,35,May
1733,Q&A Livestream - NEW ⭐️BI CAREER STARTER PROGRAM⭐️,UU1bhYMFuSFREIQ5bgclLDkQ,2023-05-08T03:10:28Z,399,25,May
1734,🚀 BI ANALYST Career Starter Program - Launch Announcement,UU1bhYMFuSFREIQ5bgclLDkQ,2023-05-05T14:00:11Z,3572,105,May
1735,New Data Hub Comparison Tool,UU1bhYMFuSFREIQ5bgclLDkQ,2023-04-19T14:30:15Z,693,30,Apr
1736,My Favourite SQL Tool - Navicat Tutorial,UU1bhYMFuSFREIQ5bgclLDkQ,2023-04-16T13:00:11Z,8482,134,Apr
1737,How I Use SQL as a BI Analyst,UU1bhYMFuSFREIQ5bgclLDkQ,2023-04-02T13:00:10Z,11068,560,Apr
1738,🚨 YOU'RE VISUALIZING YOUR DATA WRONG. And Here's Why...,UU1bhYMFuSFREIQ5bgclLDkQ,2023-03-19T14:00:09Z,8393,447,Mar
1739,🚨 LIVESTREAM - BI analyst Project portfolio Q&A,UU1bhYMFuSFREIQ5bgclLDkQ,2023-03-10T03:32:32Z,482,36,Mar
1740,🚨 LIVESTREAM - BI Tools Are Dying! And Other News...,UU1bhYMFuSFREIQ5bgclLDkQ,2023-02-24T04:01:35Z,857,29,Feb
1741,NEW ChatGPT-Powered BI Tool SNEAK PEAK! When AI Meets BI,UU1bhYMFuSFREIQ5bgclLDkQ,2023-02-17T16:00:09Z,3592,117,Feb
1742,5🔥LEARNING RESOURCES for Data Analysts!,UU1bhYMFuSFREIQ5bgclLDkQ,2023-02-15T15:00:06Z,4210,223,Feb
1743,LIVESTREAM - Career Advice (AMA) & Dashboard Build-along,UU1bhYMFuSFREIQ5bgclLDkQ,2023-02-08T03:41:26Z,683,30,Feb
1744,BI Analyst vs Data Scientist. Which is right for you?,UU1bhYMFuSFREIQ5bgclLDkQ,2023-01-19T16:00:10Z,10831,352,Jan
1745,5 Data Sources EVERY BI ANALYST Should Know,UU1bhYMFuSFREIQ5bgclLDkQ,2023-01-05T15:00:10Z,5246,231,Jan
1746,Google Analytics 4 vs. Universal Analytics - Watch This Before Upgrading!,UU1bhYMFuSFREIQ5bgclLDkQ,2022-11-29T15:11:54Z,4504,91,Nov
1747,GA4 Quota Limits - Why Your Looker Studio Reports Are Broken + Suggested Fixes,UU1bhYMFuSFREIQ5bgclLDkQ,2022-11-24T16:07:21Z,6677,173,Nov
1748,5 Reasons You SHOULDN'T USE EXCEL To Build Dashboards,UU1bhYMFuSFREIQ5bgclLDkQ,2022-11-23T18:02:17Z,2786,64,Nov
1749,BI Project Pricing and Quotations - 8 CRUCIAL Factors To Consider,UU1bhYMFuSFREIQ5bgclLDkQ,2022-11-09T15:00:09Z,4082,146,Nov
1750,Get Started as a BI CONSULTANT - A Simple Guide!,UU1bhYMFuSFREIQ5bgclLDkQ,2022-11-03T15:00:09Z,5074,250,Nov
1751,Data Analyst Portfolio Project - SQL | Step-by-Step Guide From SQL Database to Interactive Dashboard,UU1bhYMFuSFREIQ5bgclLDkQ,2022-10-14T14:00:53Z,256912,8487,Oct
1752,Google Just Killed Data Studio | R.I.P. Data Studio #killedbygoogle,UU1bhYMFuSFREIQ5bgclLDkQ,2022-10-12T19:25:21Z,6732,128,Oct
1753,Dashboard Design Tutorial For Beginners | Data Analyst Portfolio SQL Project (Part 3/3),UU1bhYMFuSFREIQ5bgclLDkQ,2022-09-20T15:00:12Z,8147,223,Sep
1754,Friday Hangout - How to cost a BI project,UU1bhYMFuSFREIQ5bgclLDkQ,2022-09-03T02:32:12Z,594,32,Sep
1755,Custom SQL Query Tutorial For Beginners | Data Analyst Portfolio Project (Part 2/3),UU1bhYMFuSFREIQ5bgclLDkQ,2022-08-16T15:00:13Z,13367,442,Aug
1756,What is Data Granularity? | BI For Beginners,UU1bhYMFuSFREIQ5bgclLDkQ,2022-08-15T14:16:41Z,6985,88,Aug
1757,Do I need Python for Business Intelligence? | BI for Beginners,UU1bhYMFuSFREIQ5bgclLDkQ,2022-08-14T13:27:39Z,8305,164,Aug
1758,How to Make Money As a BI Consultant - Tips to Starting Out,UU1bhYMFuSFREIQ5bgclLDkQ,2022-08-13T02:44:59Z,2581,119,Aug
1759,LET'S GO BI JOB HUNTING! - LIVESTREAM,UU1bhYMFuSFREIQ5bgclLDkQ,2022-08-06T02:54:02Z,753,31,Aug
1760,DASHBOARD BUILD-ALONG LIVESTREAM,UU1bhYMFuSFREIQ5bgclLDkQ,2022-07-30T02:58:26Z,1145,33,Jul
1761,7 ESSENTIAL Looker Studio HACKS EVERYONE Should Know!,UU1bhYMFuSFREIQ5bgclLDkQ,2022-07-28T16:53:20Z,23915,615,Jul
1762,Answering Your YouTube Questions - Friday Hangout,UU1bhYMFuSFREIQ5bgclLDkQ,2022-07-23T02:40:47Z,243,7,Jul
1763,Friday Hangout AMA - We're almost back! - Where I've been and What's coming up...,UU1bhYMFuSFREIQ5bgclLDkQ,2022-07-16T02:43:41Z,300,21,Jul
1764,Cleaning Data in Excel - 10 Quick Tips | Excel Tutorial for Data Analysts,UU1bhYMFuSFREIQ5bgclLDkQ,2022-03-04T11:51:17Z,5824,440,Mar
1765,Friday Hangout - AMA,UU1bhYMFuSFREIQ5bgclLDkQ,2022-02-26T02:19:58Z,549,17,Feb
1766,This Is A Game Changer! New Looker Studio Product Update - February 2022,UU1bhYMFuSFREIQ5bgclLDkQ,2022-02-24T17:24:59Z,4383,113,Feb
1767,SQL Database Design Tutorial for Beginners | Data Analyst Portfolio Project (1/3),UU1bhYMFuSFREIQ5bgclLDkQ,2022-02-18T12:00:19Z,79828,2229,Feb
1768,EXCEL ➡️ BI: Common DATA PREP Errors to Watch Out For,UU1bhYMFuSFREIQ5bgclLDkQ,2022-02-08T17:00:11Z,4179,252,Feb
1769,Learn Basic SQL in 15 Minutes (PART 3/3) | SQL Functions Tutorial | Business Intelligence,UU1bhYMFuSFREIQ5bgclLDkQ,2022-01-27T14:45:26Z,72157,1979,Jan
1770,Get Started with Looker Studio in 15 Minutes | 2023 Looker Studio Tutorial For Beginners,UU1bhYMFuSFREIQ5bgclLDkQ,2022-01-17T16:34:58Z,124661,1808,Jan
1771,7 Steps to Get Your First Business Intelligence Analyst Job | BI For Beginners,UU1bhYMFuSFREIQ5bgclLDkQ,2021-10-21T14:00:09Z,57514,2707,Oct
1772,RFM Analysis Tutorial: Simple Segmentation Analysis,UU1bhYMFuSFREIQ5bgclLDkQ,2021-10-08T13:15:12Z,35311,1128,Oct
1773,Learn Basic SQL in 15 Minutes (PART 2/3) | Creating Tables | SQL Tutorial | Business Intelligence,UU1bhYMFuSFREIQ5bgclLDkQ,2021-10-01T13:10:15Z,150150,5115,Oct
1774,Simple Linear Regression Analysis For Beginners | Basic Predictive Analytics,UU1bhYMFuSFREIQ5bgclLDkQ,2021-09-23T14:45:50Z,10250,426,Sep
1775,Why do we visualise data? #shorts,UU1bhYMFuSFREIQ5bgclLDkQ,2021-08-13T13:13:49Z,5231,374,Aug
1776,5 Google Analytics Tools To Level Up Your Reporting,UU1bhYMFuSFREIQ5bgclLDkQ,2021-07-30T14:11:56Z,1593,39,Jul
1777,BI CASE STUDY | How This Huge Brand Saved Millions With A Simple Dashboard!,UU1bhYMFuSFREIQ5bgclLDkQ,2021-06-25T13:35:44Z,12279,406,Jun
1778,What Does A BI Consultant Do? | Business Intelligence for Beginners,UU1bhYMFuSFREIQ5bgclLDkQ,2021-06-15T14:25:54Z,28486,1364,Jun
1779,5 Reasons Your Business Should Implement Business Intelligence,UU1bhYMFuSFREIQ5bgclLDkQ,2020-12-04T17:05:01Z,8957,264,Dec
1780,How To JOIN DATA In Excel Using INDEX MATCH Functions,UU1bhYMFuSFREIQ5bgclLDkQ,2020-11-27T15:05:50Z,13347,213,Nov
1781,"How To Join Data In SQL Inner Join, Left Join, Right Join, Outer Join | Relational Database Model",UU1bhYMFuSFREIQ5bgclLDkQ,2020-11-25T15:25:19Z,28912,907,Nov
