s_no,title,playlist_id,published_date,views,likes,month
975,Types Of Data Scientist In Analytics Industry,UUNU_lfiiWBdtULKOw6X0Dig,2020-10-30T12:55:01Z,4796,215,Oct
976,Updated Best YouTube Channels To Learn Data Science For Free,UUNU_lfiiWBdtULKOw6X0Dig,2020-10-28T14:16:29Z,24307,1307,Oct
977,Tutorial 2- Implementing Basic Reinforcement Learning Using Python- Data Science,UUNU_lfiiWBdtULKOw6X0Dig,2020-10-27T12:41:16Z,28042,575,Oct
978,My Entrepreneur Journey- From Software Engineer To Data Scientist To Entrepreneur- Future Plans,UUNU_lfiiWBdtULKOw6X0Dig,2020-10-26T14:30:09Z,16189,928,Oct
979,"Tutorial 3- Julia Basics-Strings And Numerical Operations, Commenting",UUNU_lfiiWBdtULKOw6X0Dig,2020-10-25T12:45:12Z,5570,183,Oct
980,Tutorial 2- Installing Julia And Running In Jupyter Notebook,UUNU_lfiiWBdtULKOw6X0Dig,2020-10-24T15:30:10Z,16664,407,Oct
981,Tutorial 1- Introduction To Julia Programming  Language For Machine Learning,UUNU_lfiiWBdtULKOw6X0Dig,2020-10-24T12:30:10Z,23465,587,Oct
982,"TensorDash- How To Monitor Your Deep Learning Model Metrics, Loss, Accuracy Using Mobile App",UUNU_lfiiWBdtULKOw6X0Dig,2020-10-23T14:43:01Z,7260,257,Oct
983,"Google Datasets Search Engine- Search All Datasets From One Place For Data Science,Machine Learning",UUNU_lfiiWBdtULKOw6X0Dig,2020-10-22T13:00:15Z,10804,379,Oct
984,"ML Interview Preparation- Important Interview Questions On Xgboost, Adaboost And Gradient Boost",UUNU_lfiiWBdtULKOw6X0Dig,2020-10-21T12:45:11Z,32379,669,Oct
985,Top 5 Programming Languages For Data Science In 2020,UUNU_lfiiWBdtULKOw6X0Dig,2020-10-20T15:03:55Z,23850,362,Oct
986,Xgboost Regression In-Depth Intuition Explained- Machine Learning Algorithms 🔥🔥🔥🔥,UUNU_lfiiWBdtULKOw6X0Dig,2020-10-19T13:30:12Z,72131,1494,Oct
987,Keras Tuner Hyperparameter Tuning-How To Select Hidden Layers And Number of Hidden Neurons In ANN,UUNU_lfiiWBdtULKOw6X0Dig,2020-10-18T13:30:12Z,74738,1608,Oct
988,Interview Prep Day 6-How To Learn Machine Learning Algorithms For Interviews-Random Forest Algo🔥🔥🔥🔥,UUNU_lfiiWBdtULKOw6X0Dig,2020-10-18T04:30:11Z,23742,537,Oct
989,How to Prepare For Deep Learning Interviews- Important Interview Questions in ANN-Part 1🔥🔥🔥🔥,UUNU_lfiiWBdtULKOw6X0Dig,2020-10-17T11:49:20Z,49342,722,Oct
990,Live - Understanding About GPU's- CPU VS GPU- Which GPU We Should Buy?,UUNU_lfiiWBdtULKOw6X0Dig,2020-10-16T16:36:51Z,4334,215,Oct
991,Why Automation Will Not Kill Data Science Jobs?,UUNU_lfiiWBdtULKOw6X0Dig,2020-10-14T14:01:29Z,10621,458,Oct
992,Future Of Python-Will It be Replaced?,UUNU_lfiiWBdtULKOw6X0Dig,2020-10-13T14:22:01Z,19033,856,Oct
993,Xgboost Classification Indepth Maths Intuition- Machine Learning Algorithms🔥🔥🔥🔥,UUNU_lfiiWBdtULKOw6X0Dig,2020-10-12T16:01:17Z,167892,2802,Oct
994,Hottest And Best Domains Where Data Scientist And Data Analyst Are Paid More Salaries 🔥🔥🔥🔥,UUNU_lfiiWBdtULKOw6X0Dig,2020-10-10T14:30:12Z,29834,888,Oct
995,Tutorial 1-What Is Reinforcement Machine Learning? 🔥🔥🔥🔥,UUNU_lfiiWBdtULKOw6X0Dig,2020-10-09T14:00:12Z,45340,942,Oct
996,Live Q&A For Aspiring  Data Scientist-Ask Any Question Regarding Data Science,UUNU_lfiiWBdtULKOw6X0Dig,2020-10-08T15:19:44Z,6517,325,Oct
997,Interview Prep Day 5-How To Learn Machine Learning Algorithms For Interviews- Logistic Regression🔥🔥🔥,UUNU_lfiiWBdtULKOw6X0Dig,2020-10-06T13:30:38Z,24548,437,Oct
998,Complete Roadmap To Follow To  Prepare Machine Learning With All Videos And Materials,UUNU_lfiiWBdtULKOw6X0Dig,2020-10-05T13:30:13Z,285237,4897,Oct
999,Path of Non Technical Person Towards Data Analytics Industry-Data Analyst And Data Scientist,UUNU_lfiiWBdtULKOw6X0Dig,2020-10-04T14:00:10Z,33286,1432,Oct
1000,Tutorial 1-Machine Learning Model Retraining Approach-Incremental And Continuous Model Training 🔥🔥🔥🔥,UUNU_lfiiWBdtULKOw6X0Dig,2020-10-03T14:56:19Z,32939,862,Oct
1001,Live- Conversation With Amit Bose-Transition From Commerce Background To Data Analyst,UUNU_lfiiWBdtULKOw6X0Dig,2020-10-02T15:03:07Z,13398,633,Oct
1002,Tutorial 2- Feature Selection-How To Drop Features Using Pearson Correlation,UUNU_lfiiWBdtULKOw6X0Dig,2020-10-02T07:08:29Z,129525,2872,Oct
1003,Complete Road Map To Prepare For Deep Learning🔥🔥🔥🔥,UUNU_lfiiWBdtULKOw6X0Dig,2020-10-01T14:58:36Z,237747,3430,Oct
1004,D-Tale The Best Library To Perform Exploratory Data Analysis Using Single Line Of Code🔥🔥🔥🔥,UUNU_lfiiWBdtULKOw6X0Dig,2020-09-30T17:15:18Z,39056,1413,Sep
1005,Tutorial 1- Feature Selection-How To Drop Constant Features Using Variance Threshold,UUNU_lfiiWBdtULKOw6X0Dig,2020-09-30T06:36:12Z,104518,1883,Sep
1006,Pandas Visual Analysis- Perform Exploratory Data Analysis In A Single Line Of Code🔥🔥🔥🔥,UUNU_lfiiWBdtULKOw6X0Dig,2020-09-29T08:53:47Z,24554,915,Sep
1007,Data Science Myths Vs Reality Explained- Sharing My Experience- Must Watch For Everyone🔥🔥🔥🔥,UUNU_lfiiWBdtULKOw6X0Dig,2020-09-27T14:30:13Z,20421,1078,Sep
1008,Interview Prep Day 4-How To Learn Machine Learning Algorithms For Interviews- Decision Trees🔥🔥,UUNU_lfiiWBdtULKOw6X0Dig,2020-09-27T05:56:30Z,33854,575,Sep
1009,How To Convert A Kaggle Project To A End To End Data Science With Deployment For Freshers 🔥🔥🔥🔥,UUNU_lfiiWBdtULKOw6X0Dig,2020-09-26T14:12:18Z,43784,1700,Sep
1010,Complete Road Map To Prepare NLP-Follow This Video-You Will Able to Crack Any DS Interviews🔥🔥,UUNU_lfiiWBdtULKOw6X0Dig,2020-09-25T13:30:11Z,635360,4746,Sep
1011,Data Science Live Q&A- Ask Any Queries Related To Data Science Interviews🔥🔥,UUNU_lfiiWBdtULKOw6X0Dig,2020-09-24T14:15:58Z,5322,310,Sep
1012,Exploring RapidMiner-Amazing Data Science Platform To Solve Machine Learning And DL Usecases,UUNU_lfiiWBdtULKOw6X0Dig,2020-09-23T14:05:50Z,9663,303,Sep
1013,Interview Prep Day3-How To Prepare Support Vector Machines Important Questions In Interviews🔥🔥,UUNU_lfiiWBdtULKOw6X0Dig,2020-09-23T11:01:44Z,26962,612,Sep
1014,Interview Prep Day 2- Linear Regression Interview Question-The Most Important Algorithm In ML & DS🔥🔥,UUNU_lfiiWBdtULKOw6X0Dig,2020-09-22T12:30:12Z,87418,2314,Sep
1015,Final Year Student To Deep Learning Engineer Internship- Transition Story- Must For Freshers,UUNU_lfiiWBdtULKOw6X0Dig,2020-09-21T15:17:04Z,11458,429,Sep
1016,Interview Prep Day 1-How To Learn Machine Learning Algorithms For Interviews- Naive Bayes Classifier,UUNU_lfiiWBdtULKOw6X0Dig,2020-09-21T07:52:26Z,300463,3048,Sep
1017,Top 5 Data Science Projects/Ideas For Your Resume For Freshers From My Playlist- Must Watch🔥🔥🔥,UUNU_lfiiWBdtULKOw6X0Dig,2020-09-20T13:00:13Z,100911,3891,Sep
1018,Focus On Story Telling-How To Ace Data Science Interviews?,UUNU_lfiiWBdtULKOw6X0Dig,2020-09-19T14:15:13Z,13740,778,Sep
1019,Tutorial 7- Database As A Service- Setting Up MongoDB ATLAS In Cloud With Python,UUNU_lfiiWBdtULKOw6X0Dig,2020-09-19T04:45:11Z,8942,213,Sep
1020,Complete Road Map To Be Expert In Python- Follow My Way,UUNU_lfiiWBdtULKOw6X0Dig,2020-09-18T14:15:12Z,1689785,18733,Sep
1021,Data Science In Medical-Live Tracking Of CO--VID Cases In India using Python,UUNU_lfiiWBdtULKOw6X0Dig,2020-09-18T04:45:14Z,12180,401,Sep
1022,How to Learn Statistics for Data Science As A Self Starter- Follow My Way,UUNU_lfiiWBdtULKOw6X0Dig,2020-09-17T14:15:13Z,292483,5319,Sep
1023,How To Set Profile And Apply Data Science Jobs In LinkedIn- Must For Freshers,UUNU_lfiiWBdtULKOw6X0Dig,2020-09-16T14:15:10Z,70454,2528,Sep
1024,"Tutorial 6- MongoDb With Python- Aggregate Functions($group,$sum,$avg,$project)- Data Science",UUNU_lfiiWBdtULKOw6X0Dig,2020-09-15T04:57:26Z,15249,278,Sep
1025,Step By Step Path Of Transition From Data Analyst To Data Scientist,UUNU_lfiiWBdtULKOw6X0Dig,2020-09-14T14:00:11Z,8996,406,Sep
1026,VGGNET Architecture In-depth Discussion Along With Code -Deep Learning Advanced CNN,UUNU_lfiiWBdtULKOw6X0Dig,2020-09-12T14:30:14Z,54224,1204,Sep
1027,Step By Step Path To Become A Data Analyst in 2020,UUNU_lfiiWBdtULKOw6X0Dig,2020-09-12T13:45:12Z,56946,2238,Sep
1028,Tutorial 3- MySQL With Python And Data Science Performing CRUD Operations On Table,UUNU_lfiiWBdtULKOw6X0Dig,2020-09-11T15:30:11Z,15940,320,Sep
1029,Live- Virtual Interview For Data Scientist By Krish And Sudhanshu,UUNU_lfiiWBdtULKOw6X0Dig,2020-09-11T15:19:38Z,18661,601,Sep
1030,Alexnet Architecture In-depth-Discussion Along With Code-Deep Learning Advanced CNN,UUNU_lfiiWBdtULKOw6X0Dig,2020-09-11T14:30:13Z,37225,752,Sep
1031,Tutorial 2- MySQL With Python And Data Science- Installing MySQL DB Connector And Creating Databases,UUNU_lfiiWBdtULKOw6X0Dig,2020-09-10T14:15:11Z,19715,417,Sep
1032,Live- How To Create Deep Learning Model Using Tensorflow JS,UUNU_lfiiWBdtULKOw6X0Dig,2020-09-09T16:37:54Z,6722,181,Sep
1033,Tutorial 1- MySQL With Python And Data Science- MySQL Installation Steps,UUNU_lfiiWBdtULKOw6X0Dig,2020-09-09T13:23:43Z,137664,1898,Sep
1034,Why Domain Knowledge Is Important In Data Science?,UUNU_lfiiWBdtULKOw6X0Dig,2020-09-07T14:00:12Z,12655,627,Sep
1035,How To Train Deep Learning Models In Google Colab- Must For Everyone,UUNU_lfiiWBdtULKOw6X0Dig,2020-09-06T14:15:12Z,270820,5036,Sep
1036,Live - Data Science Q&A And Upcoming Videos Plan,UUNU_lfiiWBdtULKOw6X0Dig,2020-09-05T15:07:24Z,3146,228,Sep
1037,Machine Learning And Deep Learning Model Deployment Architecture Using TF Lite In Mobile,UUNU_lfiiWBdtULKOw6X0Dig,2020-09-05T13:27:57Z,12068,346,Sep
1038,Special Thanks To Youtube - Happy Teacher's Day Youtube,UUNU_lfiiWBdtULKOw6X0Dig,2020-09-05T08:28:42Z,2885,300,Sep
1039,Machine Learning And Deep Learning Model Deployment Architecture Using API's,UUNU_lfiiWBdtULKOw6X0Dig,2020-09-05T05:44:41Z,32557,912,Sep
1040,Live- Virtual Interview Session For Data Science- Session 8,UUNU_lfiiWBdtULKOw6X0Dig,2020-09-04T15:18:19Z,12239,434,Sep
1041,Live -Transformers Indepth Architecture Understanding- Attention Is All You Need,UUNU_lfiiWBdtULKOw6X0Dig,2020-09-03T15:30:44Z,157181,3330,Sep
1042,Data Science Is Just Not About Model Building,UUNU_lfiiWBdtULKOw6X0Dig,2020-09-03T11:53:36Z,13719,610,Sep
1043,Live -End To End Docker Implementation Of Data  Science Projects,UUNU_lfiiWBdtULKOw6X0Dig,2020-09-02T16:14:24Z,7749,299,Sep
1044,Debugging Server Side Application Using Python In Pycharm,UUNU_lfiiWBdtULKOw6X0Dig,2020-09-01T16:43:08Z,6088,197,Sep
1045,Live Virtual Interview Of Experienced For Data Scientist,UUNU_lfiiWBdtULKOw6X0Dig,2020-09-01T14:59:41Z,58692,1442,Sep
1046,"Tutorial 7-Build,Train,Deploy Machine Learning Model AWS SageMaker- Predicting Test Data Endpoints",UUNU_lfiiWBdtULKOw6X0Dig,2020-08-31T06:03:49Z,33479,545,Aug
1047,Live- Conversation With Data Structure And Algorithms Mentor For Free Community Session,UUNU_lfiiWBdtULKOw6X0Dig,2020-08-30T16:23:00Z,9978,382,Aug
1048,"Tutorial 6-Build,Train,Deploy Machine Learning Model AWS SageMaker- Deployment Of Xgboost ML Model",UUNU_lfiiWBdtULKOw6X0Dig,2020-08-30T09:45:04Z,31836,520,Aug
1049,"Tutorial 5-Build,Train, Deploy Machine Learning Model In AWS SageMaker-Training Xgboost ML ALgo",UUNU_lfiiWBdtULKOw6X0Dig,2020-08-30T04:48:52Z,39139,578,Aug
1050,Live-How To Prepare Resume For Data Scientist As A Fresher,UUNU_lfiiWBdtULKOw6X0Dig,2020-08-29T16:20:49Z,55112,2561,Aug
1051,"Tutorial 4-Build,Train, Deploy Machine Learning Model In AWS SageMaker- Uploading Files In S3 Bucket",UUNU_lfiiWBdtULKOw6X0Dig,2020-08-29T12:18:00Z,47260,655,Aug
1052,"Tutorial 3-Build,Train, Deploy Machine Learning Model In AWS SageMaker- Creating S3 Buckets",UUNU_lfiiWBdtULKOw6X0Dig,2020-08-29T09:00:31Z,60722,891,Aug
1053,"Tutorial 2-Build,Train, Deploy Machine Learning Model In AWS SageMaker- Creating Notebook Instance",UUNU_lfiiWBdtULKOw6X0Dig,2020-08-29T04:43:07Z,82563,1351,Aug
1054,Live -Virtual Interview Of Fresher For Data Science - Session 6,UUNU_lfiiWBdtULKOw6X0Dig,2020-08-28T16:25:28Z,25117,711,Aug
1055,Live- Exploring Nvidia RAPIDS- Open GPU Data Science,UUNU_lfiiWBdtULKOw6X0Dig,2020-08-27T15:46:22Z,7218,325,Aug
1056,"Live- Attention Models, Transformers  In depth Intuition Deep Learning- Part 2",UUNU_lfiiWBdtULKOw6X0Dig,2020-08-26T17:18:56Z,35191,1112,Aug
1057,AWS SageMaker For ML And DL Tutorial Playlist- What Will We Learn In This Playlist?,UUNU_lfiiWBdtULKOw6X0Dig,2020-08-26T13:30:12Z,104573,2083,Aug
1058,Live Community Sessions Announcements- Covering All Technology Stack,UUNU_lfiiWBdtULKOw6X0Dig,2020-08-25T17:00:01Z,13846,752,Aug
1059,Silhouette (clustering)- Validating Clustering Models- Unsupervised Machine Learning,UUNU_lfiiWBdtULKOw6X0Dig,2020-08-25T13:45:11Z,54226,1320,Aug
1060,"Live Session- Encoder Decoder,Attention Models, Transformers, Bert Part 1",UUNU_lfiiWBdtULKOw6X0Dig,2020-08-24T17:02:49Z,70111,1797,Aug
1061,Pytorch Tutorial 6- How To Run Pytorch Code In GPU Using CUDA Library,UUNU_lfiiWBdtULKOw6X0Dig,2020-08-24T12:58:06Z,61083,633,Aug
1062,Live - Successful Transition Story Of SAP Consultant To Data Scientist,UUNU_lfiiWBdtULKOw6X0Dig,2020-08-23T16:07:44Z,23179,805,Aug
1063,Live Project-Cotton Disease Prediction Deep Learning Live Project Implementation,UUNU_lfiiWBdtULKOw6X0Dig,2020-08-22T15:33:44Z,101996,2260,Aug
1064,Live Virtual Interview For Data Science Fresher By Krish And Sudhanshu,UUNU_lfiiWBdtULKOw6X0Dig,2020-08-21T16:10:39Z,130169,3154,Aug
1065,Live-Best Practices For Data Science Project Development|Session By Chief Technology Officer-Ineuron,UUNU_lfiiWBdtULKOw6X0Dig,2020-08-20T15:09:11Z,8514,277,Aug
1066,Finally Built My Deep Learning And Gaming Workstation With Nvidia Titan RTX GPU 🔥🔥🔥🔥🔥- It's A Beast🔥,UUNU_lfiiWBdtULKOw6X0Dig,2020-08-20T05:01:24Z,29703,818,Aug
1067,Live Session- Understanding Attention Models Architecture And Maths Intuition- Deep Learning,UUNU_lfiiWBdtULKOw6X0Dig,2020-08-19T15:52:34Z,54320,1400,Aug
1068,Live Virtual Interview For Data Science- Background Applied Geology From IIT Kharagpur,UUNU_lfiiWBdtULKOw6X0Dig,2020-08-18T16:23:06Z,35071,950,Aug
1069,Live Project Developing AI Advertisement Platform Using Deep Learning,UUNU_lfiiWBdtULKOw6X0Dig,2020-08-17T15:24:34Z,8685,290,Aug
1070,Announcement For Give Away For Women Data Science Aspirants - Promoting Data Science,UUNU_lfiiWBdtULKOw6X0Dig,2020-08-16T16:39:56Z,6525,189,Aug
1071,Live Q&A Data Science By Krish And Sudhanshu- Give Away For Women To Promote AI,UUNU_lfiiWBdtULKOw6X0Dig,2020-08-16T16:23:03Z,10958,377,Aug
1072,Live Virtual Interview For Data Science From Teaching Assistant To Data Scientist,UUNU_lfiiWBdtULKOw6X0Dig,2020-08-14T16:18:00Z,19946,654,Aug
1073,Live Project- Web Application - Loan Default Prediction- Masters Thesis,UUNU_lfiiWBdtULKOw6X0Dig,2020-08-13T15:37:16Z,28013,673,Aug
1074,Live Interview Of Lakshay For Data Science- Commerce And Statistics Background,UUNU_lfiiWBdtULKOw6X0Dig,2020-08-12T15:52:47Z,23774,642,Aug
1075,Nvidia Titan RTX Unboxing And Specs And Comparison- Deep Learning,UUNU_lfiiWBdtULKOw6X0Dig,2020-08-11T08:03:53Z,12412,422,Aug
1076,Live Data Science Q&A With Krish And Sudhanshu- Give Away ML for Deployment+Internships For Women,UUNU_lfiiWBdtULKOw6X0Dig,2020-08-09T16:19:39Z,11347,472,Aug
1077,Live Virtual Nervous Interview Of Mechanical Engineer For Data Science,UUNU_lfiiWBdtULKOw6X0Dig,2020-08-07T16:14:28Z,26991,435,Aug
1078,Live- Discussion On Cross Validation Techniques And Selection of Machine Learning Algorithms,UUNU_lfiiWBdtULKOw6X0Dig,2020-08-06T15:59:47Z,9485,450,Aug
1079,Live Transition Story Of Civil Engineer To Data Scientist With 2 Years Gap,UUNU_lfiiWBdtULKOw6X0Dig,2020-08-05T17:00:35Z,20594,745,Aug
1080,Problems With Encoders And Decoders- Indepth Intuition,UUNU_lfiiWBdtULKOw6X0Dig,2020-08-05T04:33:15Z,31966,602,Aug
1081,Step By Step Playlist To Follow To Learn Data Science Through My Channel - Part 2,UUNU_lfiiWBdtULKOw6X0Dig,2020-08-04T16:10:41Z,31661,1206,Aug
1082,Live Virtual Interview For Data Science By Krish And Sudhanshu,UUNU_lfiiWBdtULKOw6X0Dig,2020-08-04T15:19:45Z,33802,892,Aug
1083,Step By Step Playlist To Follow To Learn Data Science Through My Channel Part 1- Must for Everyone,UUNU_lfiiWBdtULKOw6X0Dig,2020-08-03T14:00:13Z,129494,5507,Aug
1084,Live Discussion On Outlier And Its Impacts On Machine Learning UseCases,UUNU_lfiiWBdtULKOw6X0Dig,2020-08-02T16:07:35Z,49557,1987,Aug
1085,Live Discussion On Handling Imbalanced Dataset- Machine Learning,UUNU_lfiiWBdtULKOw6X0Dig,2020-08-01T16:03:37Z,75720,2766,Aug
1086,Live Virtual Interview For Internship For College Student By Krish And Sudhanshu,UUNU_lfiiWBdtULKOw6X0Dig,2020-07-31T16:16:54Z,48086,1397,Jul
1087,Pytorch Tutorial 5-Live- Kaggle Advance House Price Prediction Using Pytorch Deep Learning,UUNU_lfiiWBdtULKOw6X0Dig,2020-07-30T16:25:46Z,18280,535,Jul
1088,Live Virtual Interview For Data Science By Krish And Sudhanshu Part 2,UUNU_lfiiWBdtULKOw6X0Dig,2020-07-28T16:34:48Z,34940,977,Jul
1089,Live In-depth Discussion Of PyCaret Automated Machine Learning Library Part 2,UUNU_lfiiWBdtULKOw6X0Dig,2020-07-27T16:06:41Z,5508,247,Jul
1090,Live In-depth Discussion Of PyCaret Automated Machine Learning Library,UUNU_lfiiWBdtULKOw6X0Dig,2020-07-26T16:00:35Z,14627,485,Jul
1091,Hyperparameter Tuning Techniques Genetic Algorithms And Optuna Data Science Machine Learning- Part 2,UUNU_lfiiWBdtULKOw6X0Dig,2020-07-25T15:50:05Z,17638,626,Jul
1092,Live- Data Science Virtual Interview By Krish And Sudhanshu-Part 1,UUNU_lfiiWBdtULKOw6X0Dig,2020-07-24T14:42:06Z,91827,1805,Jul
1093,Live-Discussing All Hyperparameter Tuning Techniques Data Science Machine Learning,UUNU_lfiiWBdtULKOw6X0Dig,2020-07-23T16:29:11Z,74378,2184,Jul
1094,Live Q&A Data Science With Sudhanshu Kumar Part 2,UUNU_lfiiWBdtULKOw6X0Dig,2020-07-22T16:18:27Z,10551,395,Jul
1095,Live-Charity Stream To Help Bihar And Assam Floods- My Special Journey To 200k subscribers,UUNU_lfiiWBdtULKOw6X0Dig,2020-07-21T15:50:54Z,6677,486,Jul
1096,Live-Features Selection-Various Techniques To Select Features  Day 7,UUNU_lfiiWBdtULKOw6X0Dig,2020-07-20T16:11:03Z,55857,1556,Jul
1097,Pytorch Tutorial 4- Solving Kaggle Pima Diabetes Prediction Using ANN With PyTorch Library,UUNU_lfiiWBdtULKOw6X0Dig,2020-07-20T05:00:15Z,24527,631,Jul
1098,Live-Feature Engineering-All Standardization And Transformation Techniques- Day 6,UUNU_lfiiWBdtULKOw6X0Dig,2020-07-19T15:56:29Z,47611,1514,Jul
1099,Live-Feature Engineering- Forecasting Time Series Using Facebook Fbprophet-Day 5,UUNU_lfiiWBdtULKOw6X0Dig,2020-07-18T16:14:00Z,21755,539,Jul
1100,Summary Live Streaming-Feature Engineering- Probability Ratio Encoding- Handling Categorical Feature,UUNU_lfiiWBdtULKOw6X0Dig,2020-07-18T07:18:34Z,19776,460,Jul
1101,Summary Live Q&A-Sudhanshu Journey On Data Science,UUNU_lfiiWBdtULKOw6X0Dig,2020-07-17T15:00:34Z,10178,505,Jul
1102,Pytorch TutoriaL 3-How To Perform BackPropogation Using Pytorch,UUNU_lfiiWBdtULKOw6X0Dig,2020-07-17T08:05:40Z,14664,299,Jul
1103,Live-Feature Engineering-All Techniques To Handle Categorical Features - Day 4,UUNU_lfiiWBdtULKOw6X0Dig,2020-07-16T15:06:48Z,47634,1433,Jul
1104,Live-Feature Engineering-All Techniques To Handle Missing Values- Day 3,UUNU_lfiiWBdtULKOw6X0Dig,2020-07-15T15:31:20Z,60279,1626,Jul
1105,Live-Feature Engineering-All Techniques To Handle Missing Values- Day 2,UUNU_lfiiWBdtULKOw6X0Dig,2020-07-14T15:33:29Z,64927,1920,Jul
1106,Pytorch Tutorial 2-Understanding Of Tensors Using Pytorch,UUNU_lfiiWBdtULKOw6X0Dig,2020-07-14T10:06:31Z,23154,457,Jul
1107,Live-Feature Engineering-All Techniques To Handle Missing Values- Day 1,UUNU_lfiiWBdtULKOw6X0Dig,2020-07-13T14:59:24Z,124164,3775,Jul
1108,Live Unboxing MSI Laptop For Machine Learning And Deep Learning,UUNU_lfiiWBdtULKOw6X0Dig,2020-07-12T14:30:25Z,18879,340,Jul
1109,Pytorch Tutorial 1-Pytorch Installation For Deep Learning,UUNU_lfiiWBdtULKOw6X0Dig,2020-07-12T13:20:32Z,55479,827,Jul
1110,Live Discussion Of Roles And Responsibilities In Data Science Project- Further Announcements,UUNU_lfiiWBdtULKOw6X0Dig,2020-07-11T15:26:53Z,5957,419,Jul
1111,Live- How To Approach Interviews For Data Science,UUNU_lfiiWBdtULKOw6X0Dig,2020-07-10T14:48:35Z,8509,613,Jul
1112,Live- Implementation Of Malaria Disease Using Deep Learning End To End Projects With Deployment,UUNU_lfiiWBdtULKOw6X0Dig,2020-07-09T15:44:21Z,63197,1525,Jul
1113,Live Summary- Memory Profiler In Python- How To Effectively Check Your Code Quality With Memory,UUNU_lfiiWBdtULKOw6X0Dig,2020-07-08T15:59:07Z,13991,261,Jul
1114,Live- Implementation Of 7 HealthCare End To End Projects With Deployment,UUNU_lfiiWBdtULKOw6X0Dig,2020-07-08T14:39:45Z,86123,2001,Jul
1115,Summary Recap Of Live Implementation Of Movie Recommendation With Deployment Using Heroku,UUNU_lfiiWBdtULKOw6X0Dig,2020-07-07T14:52:52Z,27412,730,Jul
1116,Summary Of Live- Implementation Of Flight Fare Prediction Web App Project With Deployment,UUNU_lfiiWBdtULKOw6X0Dig,2020-07-07T05:09:03Z,13105,375,Jul
1117,Live Implementation Of Movie Recommendation With Deployment Using Heroku,UUNU_lfiiWBdtULKOw6X0Dig,2020-07-06T14:42:58Z,125465,3738,Jul
1118,Live- Implementation Of Flight Fare Prediction Web App Project With Deployment,UUNU_lfiiWBdtULKOw6X0Dig,2020-07-05T15:51:30Z,198780,6343,Jul
1119,Live- Implementation of Cricket Score Prediction App With Deployment For IPL(Sport Analytics),UUNU_lfiiWBdtULKOw6X0Dig,2020-07-04T14:08:38Z,65898,2540,Jul
1120,Summary of Live Discussion- Career Guidance For Freshers And Experienced In Data Science,UUNU_lfiiWBdtULKOw6X0Dig,2020-07-04T04:02:00Z,2862,199,Jul
1121,Live Discussion- Career Guidance For Freshers And Experienced In Data Science,UUNU_lfiiWBdtULKOw6X0Dig,2020-07-03T14:33:33Z,10586,888,Jul
1122,Live Discussion - How To Read Research Papers As A Data Scientist,UUNU_lfiiWBdtULKOw6X0Dig,2020-07-03T07:44:13Z,5850,260,Jul
1123,Live Project-Stock Sentiment Analysis using News Headlines Machine Learning,UUNU_lfiiWBdtULKOw6X0Dig,2020-07-02T15:21:05Z,82984,2477,Jul
1124,Live Session-Implementing Deep Learning Project From Scratch To Deployment- Heroku(Car Brand Class),UUNU_lfiiWBdtULKOw6X0Dig,2020-07-01T15:35:53Z,80934,1604,Jul
1125,Live- Implementation of End To End Kaggle Machine Learning Project With Deployment,UUNU_lfiiWBdtULKOw6X0Dig,2020-06-30T15:58:13Z,593194,13907,Jun
1126,Live-3 Weeks Big Data With Pyspark Community Classes Announcement For EveryOne For Free,UUNU_lfiiWBdtULKOw6X0Dig,2020-06-29T15:41:34Z,9661,455,Jun
1127,Live Discussion - How To Read Text From Images Using Pytesseract,UUNU_lfiiWBdtULKOw6X0Dig,2020-06-29T14:33:15Z,43548,896,Jun
1128,Live Discussion - How To Read Text From Images Using Pytesseract,UUNU_lfiiWBdtULKOw6X0Dig,2020-06-29T14:31:31Z,7104,231,Jun
1129,Live Discussion - How To Read Research Papers As A Data Scientist,UUNU_lfiiWBdtULKOw6X0Dig,2020-06-28T15:24:27Z,5592,209,Jun
1130,Live Discussion of Resume Of Data Scientist,UUNU_lfiiWBdtULKOw6X0Dig,2020-06-27T15:40:21Z,17186,540,Jun
1131,Live Discussion of Resume Of Data Scientist,UUNU_lfiiWBdtULKOw6X0Dig,2020-06-27T15:39:09Z,4173,267,Jun
1132,Encoder And Decoder- Neural Machine Learning Language Translation Tutorial With Keras- Deep Learning,UUNU_lfiiWBdtULKOw6X0Dig,2020-06-27T11:45:32Z,84264,1200,Jun
1133,How To Prepare For Applying Freelancing Jobs For Data Science,UUNU_lfiiWBdtULKOw6X0Dig,2020-06-26T15:55:12Z,15419,602,Jun
1134,Amazing Guidelines For Creating GitHub Profiles For Data Scientist,UUNU_lfiiWBdtULKOw6X0Dig,2020-06-25T15:09:03Z,35397,1166,Jun
1135,Impact Of Artificial Intelligence On Employment- Data Science,UUNU_lfiiWBdtULKOw6X0Dig,2020-06-24T15:00:11Z,5964,243,Jun
1136,Indian Paper Currency Predictor- Data Science Projects From Subscribers,UUNU_lfiiWBdtULKOw6X0Dig,2020-06-23T17:03:47Z,6169,210,Jun
1137,Deployment Of Machine Learning PIPELINES Using Dockers and Kubernetes,UUNU_lfiiWBdtULKOw6X0Dig,2020-06-23T14:09:04Z,45514,875,Jun
1138,Biggest Hurdles In AI Adoption Faced By Executives And Companies| Data Science,UUNU_lfiiWBdtULKOw6X0Dig,2020-06-22T14:45:33Z,2733,131,Jun
1139,Live Q&A -  Future Videos To Come Regarding Data Science,UUNU_lfiiWBdtULKOw6X0Dig,2020-06-21T15:48:47Z,4112,147,Jun
1140,All Automated Machine Learning Libraries At One Place- Project From Subscribers,UUNU_lfiiWBdtULKOw6X0Dig,2020-06-21T06:08:45Z,7270,318,Jun
1141,Interesting Facts And Stats On Artificial Language,UUNU_lfiiWBdtULKOw6X0Dig,2020-06-20T15:01:08Z,2640,127,Jun
1142,How To Debug Logs And Web Application In Heroku|Data Science,UUNU_lfiiWBdtULKOw6X0Dig,2020-06-20T12:00:11Z,35102,561,Jun
1143,Building Automated Exploratory Data Analysis Project- Project From Subscriber,UUNU_lfiiWBdtULKOw6X0Dig,2020-06-20T04:40:38Z,13875,541,Jun
1144,Important Point To Consider When Implementing Data Science Projects & Interviews-Must For Everyone,UUNU_lfiiWBdtULKOw6X0Dig,2020-06-19T15:20:34Z,5341,408,Jun
1145,Twitter Tweet's Analyzer Using Streamlit Web App- Projects From Subscribers,UUNU_lfiiWBdtULKOw6X0Dig,2020-06-19T12:11:39Z,9356,266,Jun
1146,Deploy Streamlit WebApp ML Models In Heroku(PAAS)- Data Science,UUNU_lfiiWBdtULKOw6X0Dig,2020-06-18T15:00:12Z,24444,486,Jun
1147,The Correct Guidance To Learn Deep Learning Techniques|Sharing My Experience,UUNU_lfiiWBdtULKOw6X0Dig,2020-06-17T13:15:04Z,16193,922,Jun
1148,Be Aware Of Data Science Job Description And Assignment,UUNU_lfiiWBdtULKOw6X0Dig,2020-06-16T16:45:15Z,17710,1005,Jun
1149,Sequence To Sequence Learning With Neural Networks| Encoder And Decoder In-depth Intuition,UUNU_lfiiWBdtULKOw6X0Dig,2020-06-16T13:00:13Z,120583,2493,Jun
1150,Salary By Developer Type Based On Experience|Analyzing Stack Overflow Developer Survey 2020,UUNU_lfiiWBdtULKOw6X0Dig,2020-06-15T15:39:35Z,3135,98,Jun
1151,Live Q&A  Data Science,UUNU_lfiiWBdtULKOw6X0Dig,2020-06-14T15:45:02Z,4427,141,Jun
1152,How To Perform Post Pruning In Decision Tree? Prevent Overfitting- Data Science,UUNU_lfiiWBdtULKOw6X0Dig,2020-06-14T13:00:13Z,38351,878,Jun
1153,Most Popular Databases Used By Professionals,UUNU_lfiiWBdtULKOw6X0Dig,2020-06-14T04:30:43Z,5242,154,Jun
1154,"Most Loved, Dreaded And Wanted Programming Languages",UUNU_lfiiWBdtULKOw6X0Dig,2020-06-13T15:45:01Z,14298,139,Jun
1155,Deploy Machine Learning Models Using StreamLit Library- Data Science,UUNU_lfiiWBdtULKOw6X0Dig,2020-06-13T14:00:12Z,102728,1584,Jun
